,sentence,jobTitle,company,estimatedDatePosted,label
0,"Über uns
",Advanced Technology Manager m w d Mitteldeutschland,Alcon Deutschland GmbH,2021-05-08,company
1,Wir von Alcon verhelfen Menschen zu einem besseren Sehvermögen.,Advanced Technology Manager m w d Mitteldeutschland,Alcon Deutschland GmbH,2021-05-08,company
2,"Wir glauben, dass Patienten unabhängig von ihren wirtschaftlichen Umständen Zugang zu hochwertiger Augenpflege haben sollten;",Advanced Technology Manager m w d Mitteldeutschland,Alcon Deutschland GmbH,2021-05-08,company
3,es bestehen jedoch Barrieren für eine gute Augengesundheit für Patienten sowohl in entwickelten als auch in aufstrebenden Märkten.,Advanced Technology Manager m w d Mitteldeutschland,Alcon Deutschland GmbH,2021-05-08,company
4,"Alcon entwickelt und produziert innovative Geräte, um den gesamten Lebenszyklus der Augenpflege zu erfüllen.",Advanced Technology Manager m w d Mitteldeutschland,Alcon Deutschland GmbH,2021-05-08,company
5,Die chirurgische Gruppe von Alcon ist einer der größten Hersteller von Geräten für die Kataraktentfernung und Laserkorrektur.,Advanced Technology Manager m w d Mitteldeutschland,Alcon Deutschland GmbH,2021-05-08,company
6,Zu den Verbraucherprodukten gehört die bekannte Opti-Free-Produktlinie mit Kontaktlinsenlösungen und verwandten Produkten.,Advanced Technology Manager m w d Mitteldeutschland,Alcon Deutschland GmbH,2021-05-08,company
7,Alcon wurde 1945 gegründet und verkauft seine Produkte in 180 Ländern weltweit.,Advanced Technology Manager m w d Mitteldeutschland,Alcon Deutschland GmbH,2021-05-08,company
8,"Ihre Aufgaben:
",Advanced Technology Manager m w d Mitteldeutschland,Alcon Deutschland GmbH,2021-05-08,tasks
9,In der Funktion als Advanced Technology Manager (m/f/d) sind Sie unter anderem zuständig für den Ausbau der Marktanteile und Umsatz im Bereich ATIOL und Diagnostik.,Advanced Technology Manager m w d Mitteldeutschland,Alcon Deutschland GmbH,2021-05-08,tasks
10,"Hierzu zählt die Demonstration der Geräte bei Ihren Kunden vor Ort, sowie die Umsetzung der Marketingstrategien im definierten Verkaufsgebiet in Mitteldeutschland.",Advanced Technology Manager m w d Mitteldeutschland,Alcon Deutschland GmbH,2021-05-08,tasks
11,"Spezialist für refraktive Intraokularlinsen (IOL) und zugehörige diagnostische Geräte
",Advanced Technology Manager m w d Mitteldeutschland,Alcon Deutschland GmbH,2021-05-08,skillset
12,"Ausbau des refraktiven Umsatzes und Absatzes
",Advanced Technology Manager m w d Mitteldeutschland,Alcon Deutschland GmbH,2021-05-08,tasks
13,"Verkaufsvorbereitung, Nachbereitung und Abschluss nach internen Vorgaben
",Advanced Technology Manager m w d Mitteldeutschland,Alcon Deutschland GmbH,2021-05-08,tasks
14,"Umsetzung der Marketing-Strategien im Verkaufsgebiet
",Advanced Technology Manager m w d Mitteldeutschland,Alcon Deutschland GmbH,2021-05-08,tasks
15,"Bedarfsanalyse, Identifizierung und Begleitung von IOL- und Diagnosegeräteprojekten
",Advanced Technology Manager m w d Mitteldeutschland,Alcon Deutschland GmbH,2021-05-08,tasks
16,"Kontinuierliche Beratung der Kunden bei Implantationen von refraktiven Intraokularlinsen und Anwendung der diagnostischen Geräte
",Advanced Technology Manager m w d Mitteldeutschland,Alcon Deutschland GmbH,2021-05-08,tasks
17,"Regelmäßige Analyse der Zielkunden
",Advanced Technology Manager m w d Mitteldeutschland,Alcon Deutschland GmbH,2021-05-08,tasks
18,"Durchführung von Schulungen und produktbezogenen Fortbildungen beim Kunden
",Advanced Technology Manager m w d Mitteldeutschland,Alcon Deutschland GmbH,2021-05-08,tasks
19,"Enge Zusammenarbeit mit den anderen Fachbereichen innerhalb der Matrix Struktur
",Advanced Technology Manager m w d Mitteldeutschland,Alcon Deutschland GmbH,2021-05-08,tasks
20,"Umsetzung neuer Technologien beim Kunden
",Advanced Technology Manager m w d Mitteldeutschland,Alcon Deutschland GmbH,2021-05-08,tasks
21,"Ihr Profil:
",Advanced Technology Manager m w d Mitteldeutschland,Alcon Deutschland GmbH,2021-05-08,skillset
22,"Erfolgreich abgeschlossenes naturwissenschaftliches oder betriebswirtschaftliches Studium, kaufmännische Ausbildung   Augenoptiker, hohes technisches Verständnis, Medizinprodukteberater
",Advanced Technology Manager m w d Mitteldeutschland,Alcon Deutschland GmbH,2021-05-08,skillset
23,"Sehr gute Kenntnisse der Ophthalmochirurgie, idealerweise der refraktiven Chirurgie
",Advanced Technology Manager m w d Mitteldeutschland,Alcon Deutschland GmbH,2021-05-08,skillset
24,"Abschlusssicherheit sowie Begeisterungsfähigkeit
",Advanced Technology Manager m w d Mitteldeutschland,Alcon Deutschland GmbH,2021-05-08,skillset
25,"Refraktiv Manager-Vorkenntnis vom Vorteil
",Advanced Technology Manager m w d Mitteldeutschland,Alcon Deutschland GmbH,2021-05-08,skillset
26,"Kundenorientierung and Freude im Umgang mit Kunden und im Präsentieren vor Gruppen
",Advanced Technology Manager m w d Mitteldeutschland,Alcon Deutschland GmbH,2021-05-08,skillset
27,"Ausgeprägte kommunikative Kompetenz (Verkaufs-, Gesprächs-, Moderations- und Präsentationstechniken)
",Advanced Technology Manager m w d Mitteldeutschland,Alcon Deutschland GmbH,2021-05-08,skillset
28,"Hohes Maß an Eigeninitiative, Sozialkompetenz und Teamfähigkeit
",Advanced Technology Manager m w d Mitteldeutschland,Alcon Deutschland GmbH,2021-05-08,skillset
29,"Wohnort im entsprechenden Verkaufsgebiet
",Advanced Technology Manager m w d Mitteldeutschland,Alcon Deutschland GmbH,2021-05-08,skillset
30,"Gute Englisch- und MS-Office-Kenntnisse
",Advanced Technology Manager m w d Mitteldeutschland,Alcon Deutschland GmbH,2021-05-08,skillset
31,Wayfair continues to build industry-shaping infrastructure and capabilities in Operations to fuel growth and delight our customers.,Continuous Improvement Lead Lich neu,Wayfair 3 1,2021-05-12,company
32,"As part of this journey, we are seeking bright, curious, and high-energy individual contributors to execute strategic initiatives that propel Wayfair from 10B in sales and beyond.",Continuous Improvement Lead Lich neu,Wayfair 3 1,2021-05-12,company
33,Wayfair Fulfillment Network is a key component of the overall supply chain and keeping our promise to the customer.,Continuous Improvement Lead Lich neu,Wayfair 3 1,2021-05-12,company
34,As a result we interact with multiple stakeholders across Wayfair who rely upon us to deliver a world-class operation.,Continuous Improvement Lead Lich neu,Wayfair 3 1,2021-05-12,company
35,Ultimately we are all working to serve the Customer but teams will have different priorities depending upon their individual objectives.,Continuous Improvement Lead Lich neu,Wayfair 3 1,2021-05-12,company
36,"This role is critical to managing these differing objectives, the flow of information between stakeholders, and ensuring all parties have sufficient clarity to move at speed and scale.",Continuous Improvement Lead Lich neu,Wayfair 3 1,2021-05-12,tasks
37,"The ideal candidate is curious, driven, impact-orientated and able to communicate across all levels of the organization.",Continuous Improvement Lead Lich neu,Wayfair 3 1,2021-05-12,skillset
38,"They will be able to network well, understanding different business plans and roadmaps, and deliver actionable insights and recommendations to operational teams.",Continuous Improvement Lead Lich neu,Wayfair 3 1,2021-05-12,skillset
39,This is a field-based role but with an opportunity to work with other global teams both field and corporate.,Continuous Improvement Lead Lich neu,Wayfair 3 1,2021-05-12,other
40,"What You'll Do
",Continuous Improvement Lead Lich neu,Wayfair 3 1,2021-05-12,tasks
41,"Own the implementation and development of lean ways of working within the Fulfillment Centre
",Continuous Improvement Lead Lich neu,Wayfair 3 1,2021-05-12,tasks
42,"Be a lean coach and mentor for the Operational managers
",Continuous Improvement Lead Lich neu,Wayfair 3 1,2021-05-12,tasks
43,"Identify opportunities for improvement through observation, discussion and data analytics
",Continuous Improvement Lead Lich neu,Wayfair 3 1,2021-05-12,tasks
44,"Lead the execution of trials and data gathering activities
",Continuous Improvement Lead Lich neu,Wayfair 3 1,2021-05-12,tasks
45,"Work as part of a wider change team within Wayfair both locally and globally
",Continuous Improvement Lead Lich neu,Wayfair 3 1,2021-05-12,tasks
46,"Develop trusting relationships with key stakeholders and leadership
",Continuous Improvement Lead Lich neu,Wayfair 3 1,2021-05-12,tasks
47,"Partner closely with a variety of groups company- wide, including transportation,, inventory planning, engineering and others to coordinate cross functional projects for your site
",Continuous Improvement Lead Lich neu,Wayfair 3 1,2021-05-12,tasks
48,"Manage multiple priorities in a fast-paced environment with effective communication and thorough follow through
",Continuous Improvement Lead Lich neu,Wayfair 3 1,2021-05-12,tasks
49,"What You’ll Need
",Continuous Improvement Lead Lich neu,Wayfair 3 1,2021-05-12,skillset
50,"Track record of delivering process improvement initiatives
",Continuous Improvement Lead Lich neu,Wayfair 3 1,2021-05-12,skillset
51,"Demonstrable experience of implementing lean ways of working in an e-commerce, supply chain, or manufacturing environment
",Continuous Improvement Lead Lich neu,Wayfair 3 1,2021-05-12,skillset
52,About Wayfair Inc.,Continuous Improvement Lead Lich neu,Wayfair 3 1,2021-05-12,company
53,Wayfair is one of the world’s largest online destinations for the home.,Continuous Improvement Lead Lich neu,Wayfair 3 1,2021-05-12,company
54,"Whether you work in our global headquarters in Boston or Berlin, or in our warehouses or offices throughout the world, we’re reinventing the way people shop for their homes.",Continuous Improvement Lead Lich neu,Wayfair 3 1,2021-05-12,company
55,"Through our commitment to industry-leading technology and creative problem-solving, we are confident that Wayfair will be home to the most rewarding work of your career.",Continuous Improvement Lead Lich neu,Wayfair 3 1,2021-05-12,company
56,"If you’re looking for rapid growth, constant learning, and dynamic challenges, then you’ll find that amazing career opportunities are knocking.",Continuous Improvement Lead Lich neu,Wayfair 3 1,2021-05-12,company
57,"No matter who you are, Wayfair is a place you can call home.",Continuous Improvement Lead Lich neu,Wayfair 3 1,2021-05-12,company
58,"We’re a community of innovators, risk-takers, and trailblazers who celebrate our differences, and know that our unique perspectives make us stronger, smarter, and well-positioned for success.",Continuous Improvement Lead Lich neu,Wayfair 3 1,2021-05-12,company
59,"We value and rely on the collective voices of our employees, customers, community, and suppliers to help guide us as we build a better Wayfair – and world – for all.",Continuous Improvement Lead Lich neu,Wayfair 3 1,2021-05-12,company
60,"Every voice, every perspective matters.",Continuous Improvement Lead Lich neu,Wayfair 3 1,2021-05-12,other
61,That’s why we’re proud to be an equal opportunity employer.,Continuous Improvement Lead Lich neu,Wayfair 3 1,2021-05-12,company
62,"We do not discriminate on the basis of race, color, ethnicity, ancestry, religion, sex, national origin, sexual orientation, age, citizenship status, marital status, disability, gender identity, gender expression, veteran status, or genetic information.",Continuous Improvement Lead Lich neu,Wayfair 3 1,2021-05-12,company
